{
  "contract": "hwm-coordination:PolicyDocument",
  "contract_version": "0.1.0-fixture",
  "document_id": "urn:hwm:coordination-policy:household-alpha:r7",
  "household_id": "urn:hwm:household:alpha",
  "authority_id": "urn:hwm:authority:alpha",
  "authority_epoch": 7,
  "issued_at": "2026-07-01T00:00:00Z",
  "policy_combining_strategy": "only_one_applicable",
  "coordination_rules": [
    {
      "rule_id": "urn:hwm:coordination-rule:shared-bedroom-hvac-all",
      "action_types": ["hwm-action:SetTemperature"],
      "purposes": ["shared-comfort-adjustment"],
      "effect_domains": ["shared-thermal-comfort"],
      "space_scope": { "mode": "listed", "values": ["urn:hwm:space:shared-bedroom"] },
      "risk_levels": ["moderate"],
      "emergency_requirement": "none",
      "response_rule": { "mode": "all", "count": 0, "rejection_effect": "blocks", "validity_seconds": 900 },
      "delegation": { "allowed": true, "delegate_role_ids": ["urn:hwm:role:comfort-delegate"] },
      "post_action_duties": [],
      "validity": { "from": "2026-07-01T00:00:00Z", "to": "2027-01-01T00:00:00Z" },
      "extensions": {}
    },
    {
      "rule_id": "urn:hwm:coordination-rule:hallway-light-preauthorized",
      "action_types": ["hwm-action:SetOn"],
      "purposes": ["routine-hallway-lighting"],
      "effect_domains": ["shared-visual-environment"],
      "space_scope": { "mode": "listed", "values": ["urn:hwm:space:hallway"] },
      "risk_levels": ["low"],
      "emergency_requirement": "none",
      "response_rule": { "mode": "none", "count": 0, "rejection_effect": "threshold_only", "validity_seconds": 300 },
      "delegation": { "allowed": false, "delegate_role_ids": [] },
      "post_action_duties": [],
      "validity": { "from": "2026-07-01T00:00:00Z", "to": "2027-01-01T00:00:00Z" },
      "extensions": {}
    },
    {
      "rule_id": "urn:hwm:coordination-rule:living-room-volume-count-two",
      "action_types": ["hwm-action:SetVolume"],
      "purposes": ["shared-media-playback"],
      "effect_domains": ["shared-acoustic-environment"],
      "space_scope": { "mode": "listed", "values": ["urn:hwm:space:living-room"] },
      "risk_levels": ["low"],
      "emergency_requirement": "none",
      "response_rule": { "mode": "count", "count": 2, "rejection_effect": "threshold_only", "validity_seconds": 600 },
      "delegation": { "allowed": false, "delegate_role_ids": [] },
      "post_action_duties": [],
      "validity": { "from": "2026-07-01T00:00:00Z", "to": "2027-01-01T00:00:00Z" },
      "extensions": { "fixture_note": "A declared test policy, not a recommended majority rule." }
    },
    {
      "rule_id": "urn:hwm:coordination-rule:verified-emergency-shutoff",
      "action_types": ["hwm-action:EmergencyShutoff"],
      "purposes": ["verified-emergency-protection"],
      "effect_domains": ["electrical-hazard-control"],
      "space_scope": { "mode": "listed", "values": ["urn:hwm:space:whole-home"] },
      "risk_levels": ["emergency"],
      "emergency_requirement": "verified",
      "response_rule": { "mode": "none", "count": 0, "rejection_effect": "threshold_only", "validity_seconds": 60 },
      "delegation": { "allowed": false, "delegate_role_ids": [] },
      "post_action_duties": ["urn:hwm:duty:record-emergency-event", "urn:hwm:duty:notify-household-after-stabilization"],
      "validity": { "from": "2026-07-01T00:00:00Z", "to": "2027-01-01T00:00:00Z" },
      "extensions": {}
    },
    {
      "rule_id": "urn:hwm:coordination-rule:ambiguous-blind-a",
      "action_types": ["hwm-action:SetBlindPosition"],
      "purposes": ["ambiguous-policy-test"],
      "effect_domains": ["shared-daylight-environment"],
      "space_scope": { "mode": "listed", "values": ["urn:hwm:space:living-room"] },
      "risk_levels": ["moderate"],
      "emergency_requirement": "none",
      "response_rule": { "mode": "all", "count": 0, "rejection_effect": "blocks", "validity_seconds": 600 },
      "delegation": { "allowed": false, "delegate_role_ids": [] },
      "post_action_duties": [],
      "validity": { "from": "2026-07-01T00:00:00Z", "to": "2027-01-01T00:00:00Z" },
      "extensions": {}
    },
    {
      "rule_id": "urn:hwm:coordination-rule:ambiguous-blind-b",
      "action_types": ["hwm-action:SetBlindPosition"],
      "purposes": ["ambiguous-policy-test"],
      "effect_domains": ["shared-daylight-environment"],
      "space_scope": { "mode": "listed", "values": ["urn:hwm:space:living-room"] },
      "risk_levels": ["moderate"],
      "emergency_requirement": "none",
      "response_rule": { "mode": "any", "count": 0, "rejection_effect": "threshold_only", "validity_seconds": 600 },
      "delegation": { "allowed": false, "delegate_role_ids": [] },
      "post_action_duties": [],
      "validity": { "from": "2026-07-01T00:00:00Z", "to": "2027-01-01T00:00:00Z" },
      "extensions": {}
    }
  ],
  "proof": { "mode": "unsigned_fixture", "verification_method": "urn:hwm:fixture:unsigned" },
  "extensions": {}
}
